id,type,title,created,collected,subreddit,upvotes,downvotes,score,n_comments,url
12cro8z,TREATMENT,Arti Mimpi Hewan Melata - puncak media,2023-04-05 19:29:26,2023-04-05,Vivatouch,1,0,1,0,https://vivatouch.us/2023/04/05/arti-mimpi-hewan-melata-puncak-media/?feed_id=2272&_unique_id=642daff6532d0
12cro4v,TREATMENT,Helt sjuk ja svär,2023-04-05 19:29:18,2023-04-05,emmaisakson,1,0,1,0,https://www.reddit.com/r/emmaisakson/comments/12cro4v/helt_sjuk_ja_svär/
12cro2k,TREATMENT,fan art of reslard dying in a glue trap,2023-04-05 19:29:14,2023-04-05,lapfoxtrax,1,0,1,0,https://i.redd.it/70um78gbp3sa1.png
12cro74,TREATMENT,I don't plan on letting you sleep today… 😼,2023-04-05 19:29:23,2023-04-05,MakeMeFeelGood,1,0,1,0,https://i.redd.it/kxhmgiav65sa1.jpg
12cro79,TREATMENT,Each man has his own vocation; his talent is his call. There is one direction in which all space is open to him. -- Ralph Waldo Emerson,2023-04-05 19:29:23,2023-04-05,Roorh,1,0,1,0,https://www.reddit.com/r/Roorh/comments/12cro79/each_man_has_his_own_vocation_his_talent_is_his/
12cro1r,TREATMENT,Internet help,2023-04-05 19:29:13,2023-04-05,techhelp,1,0,1,0,https://www.reddit.com/r/techhelp/comments/12cro1r/internet_help/
12cro29,TREATMENT,Backup to the Backup,2023-04-05 19:29:14,2023-04-05,custommagic,1,0,1,0,https://i.redd.it/kuj0rhwap3sa1.jpg
12crnyy,TREATMENT,My pants shit in me,2023-04-05 19:29:08,2023-04-05,teenagers,1,0,1,0,https://www.reddit.com/r/teenagers/comments/12crnyy/my_pants_shit_in_me/
12crnzp,TREATMENT,High Chair Compatibility - Toddler & Infants,2023-04-05 19:29:09,2023-04-05,sims4customcontent,1,0,1,0,/r/thesims4/comments/12cqrce/high_chair_compatibility_toddler_infants/
12cro5j,TREATMENT,Anyone know what happens with my prop bets for MLB if a player doesn’t end up playing? They gonna void it for me? Cuz they haven’t yet,2023-04-05 19:29:20,2023-04-05,fanduel,1,0,1,0,https://www.reddit.com/r/fanduel/comments/12cro5j/anyone_know_what_happens_with_my_prop_bets_for/
12cro0q,TREATMENT,Question about skill mastery,2023-04-05 19:29:11,2023-04-05,FClassAdventurer,1,0,1,0,https://www.reddit.com/r/FClassAdventurer/comments/12cro0q/question_about_skill_mastery/
12cro2c,TREATMENT,M18 Kurde. Stehe extrem auf hijabis(Kopftuch). Lasst zsm auf insta wichsen und geil schreiben. Tabulos.,2023-04-05 19:29:14,2023-04-05,wichsbrosneu44444,1,0,1,0,https://www.reddit.com/r/wichsbrosneu44444/comments/12cro2c/m18_kurde_stehe_extrem_auf_hijabiskopftuch_lasst/
12croa2,TREATMENT,does my buzzcut fit my forehead,2023-04-05 19:29:29,2023-04-05,malehairadvice,1,0,1,0,https://i.redd.it/6ku8hyjv65sa1.png
12crnwy,TREATMENT,Rajun’ Cajun Crawfish Boil Philanthropy event!,2023-04-05 19:29:06,2023-04-05,HuntsvilleAlabama,1,0,1,0,https://i.redd.it/h2hnb7mt65sa1.jpg
12crnz1,TREATMENT,Anyone know what’s going on with my car?,2023-04-05 19:29:08,2023-04-05,Cartalk,1,0,1,0,https://www.reddit.com/r/Cartalk/comments/12crnz1/anyone_know_whats_going_on_with_my_car/
12cro89,TREATMENT,"I can’t afford any of the official plushies, so I made one instead.",2023-04-05 19:29:25,2023-04-05,ProjectSekai,1,0,1,0,https://www.reddit.com/gallery/12cro89
12cro8i,TREATMENT,Loving the new meet your maker shirts!,2023-04-05 19:29:25,2023-04-05,DeadByDaylightFashion,1,0,1,0,https://www.reddit.com/gallery/12cro8i
12cro4h,TREATMENT,Where are the Prime rewards?,2023-04-05 19:29:18,2023-04-05,ModernWarfareII,1,0,1,0,https://www.reddit.com/r/ModernWarfareII/comments/12cro4h/where_are_the_prime_rewards/
12cro43,TREATMENT,shibarium,2023-04-05 19:29:17,2023-04-05,SHIBArmy,1,0,1,0,https://www.reddit.com/r/SHIBArmy/comments/12cro43/shibarium/
12cro9o,TREATMENT,New song of the day - Tune in and drop some feedback,2023-04-05 19:29:28,2023-04-05,Audiomacks,1,0,1,0,https://audiomack.com/mic-ruiz/song/sometimes
12cro2r,TREATMENT,"Upvotes welcome, will return the favour",2023-04-05 19:29:15,2023-04-05,FreeKarma4You,1,0,1,0,https://www.reddit.com/r/FreeKarma4You/comments/12cro2r/upvotes_welcome_will_return_the_favour/
12cro20,TREATMENT,"If anyone’s on the slopes and needs a mix to listen to, this is fire (drum & bass)",2023-04-05 19:29:14,2023-04-05,cocaine,1,0,1,0,https://www.reddit.com/r/cocaine/comments/12cro20/if_anyones_on_the_slopes_and_needs_a_mix_to/
12cro6z,TREATMENT,SAS Graduation Tickets,2023-04-05 19:29:22,2023-04-05,rutgers,1,0,1,0,https://www.reddit.com/r/rutgers/comments/12cro6z/sas_graduation_tickets/
12croaa,TREATMENT,"Some Ape Figured Out Math, So I DRS'd 200 More",2023-04-05 19:29:29,2023-04-05,Superstonk,1,0,1,0,https://i.redd.it/j5io1twap3sa1.jpg
12cro38,TREATMENT,Footswitch Toppers for Helix products?,2023-04-05 19:29:16,2023-04-05,Line6Helix,1,0,1,0,https://www.reddit.com/r/Line6Helix/comments/12cro38/footswitch_toppers_for_helix_products/
12cro0w,TREATMENT,would u take me out like this ?✨,2023-04-05 19:29:11,2023-04-05,enby,1,0,1,0,https://i.redd.it/7syvr16u65sa1.jpg
12cro7p,TREATMENT,anyone explain what is this glitch/lag??,2023-04-05 19:29:24,2023-04-05,PhoenixSC,1,0,1,0,https://i.redd.it/mdadidvap3sa1.jpg
12crnx0,TREATMENT,Poll: Which sight picture do you prefer?,2023-04-05 19:29:06,2023-04-05,CCW,1,0,1,0,https://www.reddit.com/r/CCW/comments/12crnx0/poll_which_sight_picture_do_you_prefer/
12crnyc,TREATMENT,Manifesting healing for someone else,2023-04-05 19:29:07,2023-04-05,lawofattraction,1,0,1,0,https://www.reddit.com/r/lawofattraction/comments/12crnyc/manifesting_healing_for_someone_else/
12crnwq,TREATMENT,"[Business] - Tornado reports across the U.S. reach 478, double the average for this point in a single year | NBC",2023-04-05 19:29:05,2023-04-05,AutoNewspaper,1,0,1,0,https://www.nbcnews.com/news/weather/tornado-reports-us-reach-478-double-average-point-single-year-rcna78339
12cro2h,TREATMENT,Download: Fameye - Don't Know Ft. Kofi Mole x Quamina MP Mp3,2023-04-05 19:29:14,2023-04-05,UsaView,1,0,1,0,https://usaview.us/?p=2431&feed_id=2456&_unique_id=642dafea9ec9a
12cro67,TREATMENT,My Jen Joe win,2023-04-05 19:29:21,2023-04-05,NASCARCollectors,1,0,1,0,https://www.reddit.com/gallery/12cro67
12cro4o,TREATMENT,People with expectations when it comes to gifting,2023-04-05 19:29:18,2023-04-05,rant,1,0,1,0,https://www.reddit.com/r/rant/comments/12cro4o/people_with_expectations_when_it_comes_to_gifting/
12cro22,TREATMENT,757 Devo and theses 2 guys were arrested for OBN Scoota murder,2023-04-05 19:29:14,2023-04-05,Chiraqhits,1,0,1,0,https://www.reddit.com/gallery/12cro22
12cro4r,TREATMENT,ich würde mir ja ein bunker bauen,2023-04-05 19:29:18,2023-04-05,dezwo,1,0,1,0,https://i.redd.it/61feh0v8p3sa1.png
12cro80,TREATMENT,PSYC 2200 SESS. II,2023-04-05 19:29:24,2023-04-05,UVA,1,0,1,0,https://www.reddit.com/r/UVA/comments/12cro80/psyc_2200_sess_ii/
12crnxh,TREATMENT,"Ship wars, (pick one)",2023-04-05 19:29:07,2023-04-05,unOrdinary,1,0,1,0,https://www.reddit.com/r/unOrdinary/comments/12crnxh/ship_wars_pick_one/
12cro2m,TREATMENT,"Is this exchange worth it ? I’m exchanging my functioning red 3DS for a brown DSi with a box, instruction manuals, but the DSi turns on but the screen stays black.",2023-04-05 19:29:15,2023-04-05,videogames,1,0,1,0,https://www.reddit.com/gallery/12cro2m
12crnx5,TREATMENT,tresser performed action `approvelink`,2023-04-05 19:29:06,2023-04-05,Twitter_Mod_logs,1,0,1,0,https://www.reddit.com/r/Twitter_Mod_logs/comments/12crnx5/tresser_performed_action_approvelink/
12crnxw,TREATMENT,Amateur fisting party at the doctors,2023-04-05 19:29:07,2023-04-05,Rt5634r,1,0,1,0,https://www.google.com/amp/s/juant.online/42270
12cro5n,TREATMENT,"🙂 MedArrive is hiring a remote Field Provider Paramedic Part-time/PRN - Pocomoke City,MD",2023-04-05 19:29:20,2023-04-05,himalayasapp,1,0,1,0,https://himalayas.app/companies/medarrive/jobs/field-provider-paramedic-part-time-prn-pocomoke-city-md
12cro26,TREATMENT,Finding The laughter In The Madness!#shorts,2023-04-05 19:29:14,2023-04-05,CoolCharacters,1,0,1,0,https://youtube.com/watch?v=cb57KX93Hm0&feature=share
12crnzg,TREATMENT,"Thank You, Post",2023-04-05 19:29:09,2023-04-05,TetoKasane,1,0,1,0,https://www.reddit.com/r/TetoKasane/comments/12crnzg/thank_you_post/
12cro4q,TREATMENT,Difference?,2023-04-05 19:29:18,2023-04-05,funkopop,1,0,1,0,https://www.reddit.com/gallery/12cro4q
