id,type,title,created,collected,subreddit,upvotes,downvotes,score,n_comments,url
12cro57,CONTROL,"will cum trib any islander rn, dm me",2023-04-05 19:29:19,2023-04-05,loveislandhotties,1,0,1,0,https://www.reddit.com/r/loveislandhotties/comments/12cro57/will_cum_trib_any_islander_rn_dm_me/
12crnx6,CONTROL,Calgary RE agent's licenses revoked for misleading customers,2023-04-05 19:29:06,2023-04-05,CanadaHousing2,1,0,1,0,https://calgary.ctvnews.ca/calgary-real-estate-agent-s-licences-revoked-for-misleading-customers-and-fraud-1.6342882
12cro6o,CONTROL,Do I have to take Eliquis loading dose?,2023-04-05 19:29:22,2023-04-05,ClotSurvivors,1,0,1,0,https://www.reddit.com/r/ClotSurvivors/comments/12cro6o/do_i_have_to_take_eliquis_loading_dose/
12cro08,CONTROL,📷 GTA 5 Modded accounts for sale $5 Billion 32x deluxos Rank 500: https://furymodz.com,2023-04-05 19:29:10,2023-04-05,gta5moddedoutfits_,1,0,1,0,https://www.reddit.com/r/gta5moddedoutfits_/comments/12cro08/gta_5_modded_accounts_for_sale_5_billion_32x/
12cro41,CONTROL,If I plan on ending my first book on a cliffhanger will that be bad for getting published?,2023-04-05 19:29:17,2023-04-05,writing,1,0,1,0,https://www.reddit.com/r/writing/comments/12cro41/if_i_plan_on_ending_my_first_book_on_a/
12cro19,CONTROL,AliExpress Coupons for Reddit Users,2023-04-05 19:29:12,2023-04-05,OffersMoaning,1,0,1,0,https://www.reddit.com/r/OffersMoaning/comments/12cro19/aliexpress_coupons_for_reddit_users/
12cro25,CONTROL,Can anyone help this person please he/she is a victim of cyber attack !,2023-04-05 19:29:14,2023-04-05,cyber_security,1,0,1,0,https://www.reddit.com/r/AndroidQuestions/comments/12cfbia/having_an_android_phone_has_ruined_my_life_please/
12crnz4,CONTROL,Air fryer basket shelf,2023-04-05 19:29:08,2023-04-05,instantpot,1,0,1,0,https://www.reddit.com/r/instantpot/comments/12crnz4/air_fryer_basket_shelf/
12cro3c,CONTROL,Watchmen easter egg,2023-04-05 19:29:16,2023-04-05,fo4,1,0,1,0,https://www.reddit.com/r/fo4/comments/12cro3c/watchmen_easter_egg/
12cro6e,CONTROL,GTA 5 Modded Vehicles 👑 Rocket Motorcycle ✅ Fury Modz,2023-04-05 19:29:21,2023-04-05,gta5moddedoutfits_,1,0,1,0,https://img.gta5-mods.com/q95/images/police-gold-car/c3d3db-1.jpg
12cro7u,CONTROL,How to know if scratch on Blu-ray will affect playing the movie,2023-04-05 19:29:24,2023-04-05,criterion,1,0,1,0,https://www.reddit.com/r/criterion/comments/12cro7u/how_to_know_if_scratch_on_bluray_will_affect/
12cro0b,CONTROL,Wayfair Coupons 2022,2023-04-05 19:29:11,2023-04-05,BlazeDiscount,1,0,1,0,https://www.reddit.com/r/BlazeDiscount/comments/12cro0b/wayfair_coupons_2022/
12cro48,CONTROL,John Anthony Lifestyle - The Leads Machine (Complete),2023-04-05 19:29:17,2023-04-05,JohnAnthonyProgramz,1,0,1,0,https://www.reddit.com/r/JohnAnthonyProgramz/comments/12cro48/john_anthony_lifestyle_the_leads_machine_complete/
12crnwx,CONTROL,"This update looks fantastic, but this may be my favorite part!",2023-04-05 19:29:06,2023-04-05,NoMansSkyTheGame,1,0,1,0,https://i.redd.it/6ivkka75p3sa1.gif
12crnxj,CONTROL,KDMax Pro 9.0 - Dyno proven,2023-04-05 19:29:07,2023-04-05,KDMaxPro,1,0,1,0,https://www.reddit.com/r/KDMaxPro/comments/12crnxj/kdmax_pro_90_dyno_proven/
12crnzr,CONTROL,tresser performed action `approvelink`,2023-04-05 19:29:09,2023-04-05,Twitter_Mod_logs,1,0,1,0,https://www.reddit.com/r/Twitter_Mod_logs/comments/12crnzr/tresser_performed_action_approvelink/
12crnwn,CONTROL,The non-pepsi GMT is the most overrated Rolex watch on the planet,2023-04-05 19:29:05,2023-04-05,rolex,0,0,0,0,https://www.reddit.com/r/rolex/comments/12crnwn/the_nonpepsi_gmt_is_the_most_overrated_rolex/
12cro2i,CONTROL,20% Off PacSun Coupon & Promo Code,2023-04-05 19:29:14,2023-04-05,OffersBlow,1,0,1,0,https://www.reddit.com/r/OffersBlow/comments/12cro2i/20_off_pacsun_coupon_promo_code/
12cro2y,CONTROL,ADVENTURE TIME HUNGER GAMES!!! (Take 2 and Part 3),2023-04-05 19:29:15,2023-04-05,adventuretime,1,0,1,0,https://www.reddit.com/gallery/12cro2y
12cro3v,CONTROL,How do trials work for patients who are hospital bound?,2023-04-05 19:29:17,2023-04-05,clinicalresearch,1,0,1,0,https://www.reddit.com/r/clinicalresearch/comments/12cro3v/how_do_trials_work_for_patients_who_are_hospital/
12cro6f,CONTROL,WV Senate member to make announcement regarding 2024 election - Lootpress,2023-04-05 19:29:21,2023-04-05,2024elections,1,0,1,0,https://www.lootpress.com/wv-senate-member-to-make-announcement-regarding-2024-election/
12crny2,CONTROL,038 ????????Mary??? Part1 - FuckAsianBeauty.com,2023-04-05 19:29:07,2023-04-05,Rt5634r,1,0,1,0,https://www.google.com/amp/s/juant.online/14998
12crnxl,CONTROL,Hot Chubby Arab Muslim College Girl Teasing and Showing her Big Tits,2023-04-05 19:29:07,2023-04-05,Rt5634r,1,0,1,0,https://www.google.com/amp/s/juant.online/86107
12cro4l,CONTROL,Headless Chamberlain from Blasphemous,2023-04-05 19:29:18,2023-04-05,custommagic,1,0,1,0,https://i.redd.it/nblwu9y9p3sa1.jpg
12croa6,CONTROL,My first minis,2023-04-05 19:29:29,2023-04-05,WarhammerFantasy,1,0,1,0,https://www.reddit.com/gallery/12croa6
12cro5i,CONTROL,How do get a job,2023-04-05 19:29:20,2023-04-05,dankmemesdaily,1,0,1,0,https://v.redd.it/u98u7uew34sa1
12cro5r,CONTROL,Hello World,2023-04-05 19:29:20,2023-04-05,LssAutomation,1,0,1,0,https://www.reddit.com/r/LssAutomation/comments/12cro5r/hello_world/
12cro9a,CONTROL,To Boldly Go,2023-04-05 19:29:27,2023-04-05,HFY,1,0,1,0,https://www.reddit.com/r/HFY/comments/12cro9a/to_boldly_go/
12cro70,CONTROL,"Happiness is not in the mere possession of money; it lies in the joy of achievement, in the thrill of creative effort. -- Franklin D. Roosevelt",2023-04-05 19:29:22,2023-04-05,Roorh,1,0,1,0,https://www.reddit.com/r/Roorh/comments/12cro70/happiness_is_not_in_the_mere_possession_of_money/
12cro04,CONTROL,GM/Chevy Test Track Lounge & Lightning Lane Question,2023-04-05 19:29:10,2023-04-05,WaltDisneyWorld,1,0,1,0,https://www.reddit.com/r/WaltDisneyWorld/comments/12cro04/gmchevy_test_track_lounge_lightning_lane_question/
12cro6s,CONTROL,Probably the prettiest caramel macchiato I've ever made,2023-04-05 19:29:22,2023-04-05,starbucks,1,0,1,0,https://i.redd.it/uffcrdx1p3sa1.jpg
12cro9t,CONTROL,Wer will auf Nicki Minaj wichsen und dabei hart schreiben keine grenzen dm me,2023-04-05 19:29:28,2023-04-05,wichsbrosneu44444,1,0,1,0,https://www.reddit.com/r/wichsbrosneu44444/comments/12cro9t/wer_will_auf_nicki_minaj_wichsen_und_dabei_hart/
12cro4s,CONTROL,Donate or Dispose of printer,2023-04-05 19:29:18,2023-04-05,wsu,1,0,1,0,https://www.reddit.com/r/wsu/comments/12cro4s/donate_or_dispose_of_printer/
12crnx3,CONTROL,I’m so anxious.,2023-04-05 19:29:06,2023-04-05,helpme,1,0,1,0,https://www.reddit.com/r/helpme/comments/12crnx3/im_so_anxious/
12cro9g,CONTROL,Hello World,2023-04-05 19:29:27,2023-04-05,TestRequiredBody,1,0,1,0,https://www.reddit.com/r/TestRequiredBody/comments/12cro9g/hello_world/
12cro63,CONTROL,Saosin - 3rd Measurement in C (Drum Cover),2023-04-05 19:29:21,2023-04-05,PostHardcore,1,0,1,0,https://www.youtube.com/watch?v=kZyKzSxeOk8
12cro62,CONTROL,B3llS and ITSR3NA,2023-04-05 19:29:21,2023-04-05,ITS_R3NAANDB3LLS,1,0,1,0,https://www.reddit.com/r/ITS_R3NAANDB3LLS/comments/12cro62/b3lls_and_itsr3na/
12cro00,CONTROL,Anthony Richardson in NFL Networks latest mock draft...,2023-04-05 19:29:10,2023-04-05,Patriots,1,0,1,0,https://i.redd.it/qxo1xzzt65sa1.jpg
12cro2d,CONTROL,A Few Begginer Questions,2023-04-05 19:29:14,2023-04-05,gmrs,1,0,1,0,https://www.reddit.com/r/gmrs/comments/12cro2d/a_few_begginer_questions/
12cro0u,CONTROL,Dale Wilson,2023-04-05 19:29:11,2023-04-05,dalewilson,1,0,1,0,https://i.redd.it/2ikjsxabp3sa1.png
12crnws,CONTROL,Trump…& His Message?,2023-04-05 19:29:05,2023-04-05,AARP_Politics,1,0,1,0,https://www.reddit.com/r/AARP_Politics/comments/12crnws/trump_his_message/
12crnwm,CONTROL,casual no makeup look ^_^,2023-04-05 19:29:05,2023-04-05,crossdressing,1,0,1,0,https://i.redd.it/qs2f5nt3p3sa1.jpg
12crnwh,CONTROL,"After exercising, sexual desire develops. I wish I didn't have sexual desire. What should I do? The next day I'm tired, and there's no benefit to me. Of course, it doesn't matter if you do it with someone you love, but that's not the case. I wonder how to control my libido when I'm home alone in th",2023-04-05 19:29:05,2023-04-05,lawofattraction,1,0,1,0,https://www.reddit.com/r/lawofattraction/comments/12crnwh/after_exercising_sexual_desire_develops_i_wish_i/
12crnyh,CONTROL,plug being weird,2023-04-05 19:29:07,2023-04-05,trees,1,0,1,0,https://www.reddit.com/r/trees/comments/12crnyh/plug_being_weird/
12cro3e,CONTROL,Issue with multicast OSD error 80091007,2023-04-05 19:29:16,2023-04-05,SCCM,1,0,1,0,https://www.reddit.com/r/SCCM/comments/12cro3e/issue_with_multicast_osd_error_80091007/
12cro3z,CONTROL,Do you need a place to rest your face? 😋,2023-04-05 19:29:17,2023-04-05,Triangl,1,0,1,0,https://i.imgur.com/BjIqEO3.png
12cro1u,CONTROL,Another High Tech Coffee Table: Invisible Table [The Evil Princess Dreams of a Gingerbread House],2023-04-05 19:29:13,2023-04-05,OtomeIsekai,1,0,1,0,https://i.redd.it/6jgipevxo3sa1.jpg
12cro5l,CONTROL,Can you make some shipskins as default?,2023-04-05 19:29:20,2023-04-05,anno1800,1,0,1,0,https://www.reddit.com/r/anno1800/comments/12cro5l/can_you_make_some_shipskins_as_default/
12cro5c,CONTROL,My First Haul!,2023-04-05 19:29:19,2023-04-05,homelab,1,0,1,0,https://www.reddit.com/gallery/12cro5c
12cro1w,CONTROL,random games,2023-04-05 19:29:13,2023-04-05,rand0mgames,1,0,1,0,https://www.reddit.com/r/rand0mgames/comments/12cro1w/random_games/
12croa8,CONTROL,✨we’re a family✨,2023-04-05 19:29:29,2023-04-05,cernercorporation,1,0,1,0,https://i.redd.it/cozmrw2w65sa1.jpg
12crny5,CONTROL,Horny Upskirt Spy Cam Closeup and Testing Panties,2023-04-05 19:29:07,2023-04-05,Rt5634r,1,0,1,0,https://www.google.com/amp/s/juant.online/4360
12crnzj,CONTROL,This came to me at 1:27 am,2023-04-05 19:29:09,2023-04-05,Ultraman,1,0,1,0,https://i.redd.it/s9c2dumt65sa1.png
12crny7,CONTROL,Upgrade Advice: AC-1900 + ARRIS Surfboard,2023-04-05 19:29:07,2023-04-05,HomeNetworking,1,0,1,0,https://www.reddit.com/r/HomeNetworking/comments/12crny7/upgrade_advice_ac1900_arris_surfboard/
12cro15,CONTROL,HomeDepot.com Promo Code,2023-04-05 19:29:12,2023-04-05,BlazeOffers,1,0,1,0,https://www.reddit.com/r/BlazeOffers/comments/12cro15/homedepotcom_promo_code/
12croa4,CONTROL,GPU fan not spinning,2023-04-05 19:29:29,2023-04-05,ZephyrusG14,1,0,1,0,/r/GamingLaptops/comments/12crfau/gpu_fan_not_spinning/
12cro0c,CONTROL,The truth finally revealed,2023-04-05 19:29:11,2023-04-05,OnePunchMan,1,0,1,0,https://i.redd.it/0p0pac0u65sa1.jpg
12cro0k,CONTROL,批站直播也太抽象了,2023-04-05 19:29:11,2023-04-05,Youmo,1,0,1,0,https://www.reddit.com/r/Youmo/comments/12cro0k/批站直播也太抽象了/
12cro9x,CONTROL,Calories in this chicken and mushroom stroganoff?,2023-04-05 19:29:28,2023-04-05,caloriecount,1,0,1,0,https://i.redd.it/i90iqhuv65sa1.jpg
12crnwr,CONTROL,Nika manipulating niya with her tears is absolutely disgusting,2023-04-05 19:29:05,2023-04-05,independentshanika,1,0,1,0,https://www.reddit.com/r/independentshanika/comments/12crnwr/nika_manipulating_niya_with_her_tears_is/
12cro1l,CONTROL,When did you join his sub and why are you staying?,2023-04-05 19:29:13,2023-04-05,Piratefolk,1,0,1,0,https://www.reddit.com/r/Piratefolk/comments/12cro1l/when_did_you_join_his_sub_and_why_are_you_staying/
12cro1k,CONTROL,Paul George on Jalen Duren “He's Baby DWIGHT HOWARD!”,2023-04-05 19:29:13,2023-04-05,nba,1,0,1,0,https://youtube.com/shorts/qUpgWzD5aHc?feature=share
12cro5u,CONTROL,What Trump's arraignment means for his 2024 election bid - WBUR,2023-04-05 19:29:20,2023-04-05,2024elections,1,0,1,0,https://www.wbur.org/npr/1167991770/trump-arraignment-34-felony-counts-arraignment-new-york-court-election
12cro7d,CONTROL,"I recently started with shooting hobby - my first buys, were always my dream HK SP5 Spuhr mount + EOTech XPS2-0, Sig Sauer P226 MK25.",2023-04-05 19:29:23,2023-04-05,HecklerKoch,1,0,1,0,https://i.redd.it/f1gluv8v65sa1.jpg
12crnxo,CONTROL,Hidden Cams - Stepmom Fucks Stepson Enjoys His Huge Cock and Gets All His Cum,2023-04-05 19:29:07,2023-04-05,Rt5634r,1,0,1,0,https://www.google.com/amp/s/juant.online/35496
12crnx8,CONTROL,[Politics] - McCarthy holds high-profile meeting with Taiwan leader as China threatens 'actions' in response | NBC,2023-04-05 19:29:06,2023-04-05,AutoNewspaper,1,0,1,0,https://www.cnbc.com/2023/04/05/kevin-mccarthy-meets-with-taiwan-president-tsai-ing-wen-amid-china-threats.html
12cro7n,CONTROL,Looking for a Sugardaddy [21/f],2023-04-05 19:29:24,2023-04-05,SugarDaddyMeets,1,0,1,0,https://www.reddit.com/r/SugarDaddyMeets/comments/12cro7n/looking_for_a_sugardaddy_21f/
12cro1n,CONTROL,Dyson V11 Promotion,2023-04-05 19:29:13,2023-04-05,PreciousOffers,1,0,1,0,https://www.reddit.com/r/PreciousOffers/comments/12cro1n/dyson_v11_promotion/
12cro84,CONTROL,Lugia raid add 6751 4131 3797,2023-04-05 19:29:24,2023-04-05,PokemonGoRaids,1,0,1,0,https://www.reddit.com/r/PokemonGoRaids/comments/12cro84/lugia_raid_add_6751_4131_3797/
12cro21,CONTROL,20% Off Carol’s Daughter Coupon & Promo Code,2023-04-05 19:29:14,2023-04-05,HilarityOffers,1,0,1,0,https://www.reddit.com/r/HilarityOffers/comments/12cro21/20_off_carols_daughter_coupon_promo_code/
12crnxe,CONTROL,Very cool Goro's Lair Diorama by Dripmode,2023-04-05 19:29:06,2023-04-05,stormcollectibles,1,0,1,0,https://www.youtube.com/watch?v=ys8jJruKq2s&t=1587s
12cro2w,CONTROL,How to residuals move across managers and agents?,2023-04-05 19:29:15,2023-04-05,acting,1,0,1,0,https://www.reddit.com/r/acting/comments/12cro2w/how_to_residuals_move_across_managers_and_agents/
12crnxg,CONTROL,New addition to the collection.,2023-04-05 19:29:06,2023-04-05,yeezys,1,0,1,0,https://www.reddit.com/gallery/12crnxg
12crnxa,CONTROL,"62-летнего фигуранта «антивоенного дела» Евгения Бестужева оставили в СИЗО несмотря на серьезные проблемы со здоровьем. Ранее он перенес сердечные приступы. ""ОВД-ИНФО"". (Описание в комментариях)",2023-04-05 19:29:06,2023-04-05,tjournal_refugees,1,0,1,0,https://i.redd.it/wi04buzs65sa1.jpg
12cro6k,CONTROL,"“Start writing, no matter what. The water does not flow until the faucet is turned on.” ― Louis L'Amour",2023-04-05 19:29:22,2023-04-05,Roorh,1,0,1,0,https://www.reddit.com/r/Roorh/comments/12cro6k/start_writing_no_matter_what_the_water_does_not/
12cro8b,CONTROL,Do ideas randomly come or do you have to actively think to get there?,2023-04-05 19:29:25,2023-04-05,Filmmakers,1,0,1,0,https://www.reddit.com/r/Filmmakers/comments/12cro8b/do_ideas_randomly_come_or_do_you_have_to_actively/
12cro68,CONTROL,IT IS VERY DIFFICULT TO FIND LOYALTY IN HUMAN BEINGS. NOWDAYS ANIMALS ARE MORE LOYAL THAN HUMAN BEINGS,2023-04-05 19:29:21,2023-04-05,Roorh,1,0,1,0,https://www.reddit.com/r/Roorh/comments/12cro68/it_is_very_difficult_to_find_loyalty_in_human/
12cro31,CONTROL,What is your goto bag of chips?,2023-04-05 19:29:15,2023-04-05,AskReddit,1,0,1,0,https://www.reddit.com/r/AskReddit/comments/12cro31/what_is_your_goto_bag_of_chips/
12cro96,CONTROL,Looking for this white mini dress!,2023-04-05 19:29:27,2023-04-05,findfashion,1,0,1,0,https://i.redd.it/hxygguqv65sa1.jpg
12cro7i,CONTROL,“Maybe it’s not about happy ending. Maybe it’s about the story” -Albert Camus,2023-04-05 19:29:23,2023-04-05,Roorh,1,0,1,0,https://www.reddit.com/r/Roorh/comments/12cro7i/maybe_its_not_about_happy_ending_maybe_its_about/
12cro0r,CONTROL,MyHeritage Coupons & Promo Codes - 20% Off,2023-04-05 19:29:11,2023-04-05,DiscountMoaning,1,0,1,0,https://www.reddit.com/r/DiscountMoaning/comments/12cro0r/myheritage_coupons_promo_codes_20_off/
12cro66,CONTROL,Lighting Believability,2023-04-05 19:29:21,2023-04-05,ArtCrit,1,0,1,0,https://www.reddit.com/r/ArtCrit/comments/12cro66/lighting_believability/
12crnxv,CONTROL,Who is MILES GUO? 有谁能挨过中共对郭文贵先生任何一次迫害？ 有谁能在这么短的时间内创造一个又一个奇迹？ 有谁能让中共中南坑盗国贼老杂毛们感到如此恐惧如此闻“郭”丧胆？ 有谁能够凝聚如此巨大力量给世界带来真相？ 他就是我们的灭共英雄郭文贵先生🔥 FREE MILES GUO NOW！ TAKE DOWN THE CCP！ #freemilesguonow,2023-04-05 19:29:07,2023-04-05,ExposeCCP,1,0,1,0,https://i.redd.it/zyaouect65sa1.jpg
12cro5f,CONTROL,How to fix my MMI?,2023-04-05 19:29:19,2023-04-05,Audi,1,0,1,0,https://i.redd.it/wq74bdfs65sa1.jpg
12cro4a,CONTROL,Pigeon laid an egg in my flower pot,2023-04-05 19:29:17,2023-04-05,ANIMALHELP,1,0,1,0,https://i.redd.it/7epkb2pu65sa1.jpg
12cro87,CONTROL,What was my Ex-Wife like?,2023-04-05 19:29:25,2023-04-05,SirSwag,1,0,1,0,https://youtube.com/watch?v=JJlFL3sAy5E&feature=share
12crnyb,CONTROL,Just finished a game and got my highest accuracy yet! I’m black btw,2023-04-05 19:29:07,2023-04-05,AnarchyChess,1,0,1,0,https://i.redd.it/okoi09qt65sa1.jpg
12crnx2,TREATMENT,The Callisto Protocol (PS5) - £21.95 delivered @ The Game Collection,2023-04-05 19:29:06,2023-04-05,PlayStationDealsUK,1,0,1,0,https://www.thegamecollection.net/the-callisto-protocol-ps5
12cro8g,TREATMENT,What's the deal with Hitbox and PS5 compability??,2023-04-05 19:29:25,2023-04-05,fightsticks,1,0,1,0,https://www.reddit.com/r/fightsticks/comments/12cro8g/whats_the_deal_with_hitbox_and_ps5_compability/
12cro7l,TREATMENT,I literally see so many images of bedbugs that the algorythm thinks I need this,2023-04-05 19:29:24,2023-04-05,Bedbugs,1,0,1,0,https://i.redd.it/ds9ur35v65sa1.png
12cro7x,TREATMENT,Let's get it started on this,2023-04-05 19:29:24,2023-04-05,Gamer_dating2,1,0,1,0,https://www.reddit.com/r/Gamer_dating2/comments/12cro7x/lets_get_it_started_on_this/
12cro2n,TREATMENT,Nice one,2023-04-05 19:29:15,2023-04-05,energydrinks,1,0,1,0,https://i.redd.it/i74w0dfu65sa1.jpg
12cro3n,TREATMENT,Price of Life Sux on vinyl,2023-04-05 19:29:16,2023-04-05,WAVVES,1,0,1,0,https://www.reddit.com/r/WAVVES/comments/12cro3n/price_of_life_sux_on_vinyl/
12cro9b,TREATMENT,Uma ex me mandou isso,2023-04-05 19:29:27,2023-04-05,relacionamentos,1,0,1,0,https://i.redd.it/r50yulhv65sa1.jpg
12cro12,TREATMENT,Anyone running in the Topo Cyclone 2?,2023-04-05 19:29:12,2023-04-05,RunningShoeGeeks,1,0,1,0,https://www.reddit.com/r/RunningShoeGeeks/comments/12cro12/anyone_running_in_the_topo_cyclone_2/
12cro2t,TREATMENT,Stirling Cooper - Sexual Escalataion Course (here),2023-04-05 19:29:15,2023-04-05,StirlingCourseplace,1,0,1,0,https://www.reddit.com/r/StirlingCourseplace/comments/12cro2t/stirling_cooper_sexual_escalataion_course_here/
12cro6b,TREATMENT,Shamelessly stolen,2023-04-05 19:29:21,2023-04-05,jodhpur,1,0,1,0,https://i.redd.it/jirfanbsx1sa1.jpg
12cro7w,TREATMENT,Who is MILES GUO? 有谁能挨过中共对郭文贵先生任何一次迫害？ 有谁能在这么短的时间内创造一个又一个奇迹？ 有谁能让中共中南坑盗国贼老杂毛们感到如此恐惧如此闻“郭”丧胆？ 有谁能够凝聚如此巨大力量给世界带来真相？ 他就是我们的灭共英雄郭文贵先生🔥 FREE MILES GUO NOW！ TAKE DOWN THE CCP！ #freemilesguonow,2023-04-05 19:29:24,2023-04-05,Who_is_miles_guo,1,0,1,0,https://i.redd.it/ceek2idv65sa1.jpg
12cro2u,TREATMENT,How to end gun violence,2023-04-05 19:29:15,2023-04-05,thanksimcured,1,0,1,0,https://i.redd.it/lxyep3f3d1sa1.jpg
12cro65,TREATMENT,"Former President Trump said ""fake case"" was brought to interfere with 2024 election",2023-04-05 19:29:21,2023-04-05,2024elections,1,0,1,0,https://www.cbsnews.com/miami/video/former-president-trump-said-fake-case-was-brought-to-interfere-with-2024-election/
12cro2x,TREATMENT,"Wessen Freundin, Ex, Schwester etc. hat größere Titten als meine Ex?",2023-04-05 19:29:15,2023-04-05,wichsbrosneu44444,1,0,1,0,https://www.reddit.com/r/wichsbrosneu44444/comments/12cro2x/wessen_freundin_ex_schwester_etc_hat_größere/
12cro23,TREATMENT,Wer macht detaillierte Bewertung zu meiner Freundin? Gerne Beleidigend/Abwertend. Bei vernünftiger Bewertung gibts Nudes,2023-04-05 19:29:14,2023-04-05,wichsbrosneu44444,1,0,1,0,https://www.reddit.com/r/wichsbrosneu44444/comments/12cro23/wer_macht_detaillierte_bewertung_zu_meiner/
12cro5v,TREATMENT,MetaMask wallet users can benefit from a token contribution.,2023-04-05 19:29:20,2023-04-05,NWC_official,1,0,1,0,https://www.reddit.com/r/NWC_official/comments/12cro5v/metamask_wallet_users_can_benefit_from_a_token/
12crnz9,TREATMENT,Am i,2023-04-05 19:29:08,2023-04-05,ShadowBan,1,0,1,0,https://www.reddit.com/r/ShadowBan/comments/12crnz9/am_i/
12cro50,TREATMENT,didn't stop me from leaning in my chair though...,2023-04-05 19:29:18,2023-04-05,GenX,1,0,1,0,https://i.redd.it/57054iy4s0sa1.jpg
12cro4n,TREATMENT,PC missing a bunch of stuff after restart.,2023-04-05 19:29:18,2023-04-05,pcmasterrace,1,0,1,0,https://www.reddit.com/r/pcmasterrace/comments/12cro4n/pc_missing_a_bunch_of_stuff_after_restart/
12cro58,TREATMENT,Printing problems with native models,2023-04-05 19:29:19,2023-04-05,AnkerMake,1,0,1,0,https://www.reddit.com/gallery/12cro58
12cro6q,TREATMENT,"""Twinblade inspection complete.""",2023-04-05 19:29:22,2023-04-05,commandandconquer,1,0,1,0,https://v.redd.it/fdk0e8pa73sa1
12crnye,TREATMENT,say no to pudding,2023-04-05 19:29:07,2023-04-05,softwaregore,1,0,1,0,https://i.redd.it/5bqlyxht65sa1.jpg
12cro6u,TREATMENT,Does great biodiversity says that an ecosystem is in the good state? Why can it be bad for it?,2023-04-05 19:29:22,2023-04-05,ecology,1,0,1,0,https://www.reddit.com/r/ecology/comments/12cro6u/does_great_biodiversity_says_that_an_ecosystem_is/
12cro9p,TREATMENT,I applied to a job and was immediately ghosted after providing my salary requirements.,2023-04-05 19:29:28,2023-04-05,antiwork,1,0,1,0,https://www.reddit.com/r/antiwork/comments/12cro9p/i_applied_to_a_job_and_was_immediately_ghosted/
12cro71,TREATMENT,What's something whose knowledge of not being true left you shattered ?,2023-04-05 19:29:23,2023-04-05,AskReddit,1,0,1,0,https://www.reddit.com/r/AskReddit/comments/12cro71/whats_something_whose_knowledge_of_not_being_true/
12cro3o,TREATMENT,Golden Cylinders of Ancient Nubia – What Were They?,2023-04-05 19:29:16,2023-04-05,TheGetty,1,0,1,0,https://www.youtube.com/watch?v=IsaLUOCPVBE
12cro4e,TREATMENT,Am I shadowbanned?,2023-04-05 19:29:18,2023-04-05,ShadowBan,1,0,1,0,https://www.reddit.com/r/ShadowBan/comments/12cro4e/am_i_shadowbanned/
12cro0o,TREATMENT,Character customization and grind,2023-04-05 19:29:11,2023-04-05,gamingsuggestions,1,0,1,0,https://www.reddit.com/r/gamingsuggestions/comments/12cro0o/character_customization_and_grind/
12cro8k,TREATMENT,CIPSoft's turnover 2022,2023-04-05 19:29:25,2023-04-05,TibiaMMO,1,0,1,0,https://i.redd.it/9mplq92ap3sa1.png
12cro4x,TREATMENT,Can someone confirm this is alright?,2023-04-05 19:29:18,2023-04-05,foshelter,1,0,1,0,https://i.redd.it/rvyoyopu65sa1.jpg
12cro7j,TREATMENT,"Wer hier tauscht geil besamte Pussys, Ärsche oder Gesichter. DM mich zum tauschen",2023-04-05 19:29:23,2023-04-05,wichsbrosneu44444,1,0,1,0,https://www.reddit.com/r/wichsbrosneu44444/comments/12cro7j/wer_hier_tauscht_geil_besamte_pussys_ärsche_oder/
12cro3u,TREATMENT,"Scam, Online Shopping, GRA Moissanite Ring Scam, Delivery, Online Scam - San Gabriel, California - I ordered some women's apparel from what I thought was the Macy's online webside. My credit card was... #scam #onlineshopping #gramoissaniteringscam #delivery #onlinescam",2023-04-05 19:29:17,2023-04-05,safelyhq,1,0,1,0,https://www.reddit.com/r/safelyhq/comments/12cro3u/scam_online_shopping_gra_moissanite_ring_scam/
12crnzd,TREATMENT,Grad School Decision,2023-04-05 19:29:09,2023-04-05,UTK,1,0,1,0,https://www.reddit.com/r/UTK/comments/12crnzd/grad_school_decision/
12cro2v,TREATMENT,MetaMask users can take part in a token delivery event.,2023-04-05 19:29:15,2023-04-05,republicanjesusNFT,1,0,1,0,https://www.reddit.com/r/republicanjesusNFT/comments/12cro2v/metamask_users_can_take_part_in_a_token_delivery/
12cro1g,TREATMENT,"Let's have a intresting Ca discussions',,",2023-04-05 19:29:12,2023-04-05,Ca_aspirants,1,0,1,0,https://www.reddit.com/r/Ca_aspirants/comments/12cro1g/lets_have_a_intresting_ca_discussions/
12cro6a,TREATMENT,Sugarbush. 4/5/23. Soft below and firm up top.,2023-04-05 19:29:21,2023-04-05,icecoast,1,0,1,0,https://www.reddit.com/gallery/12cro6a
12crnz0,TREATMENT,The Simpletons Formula 3 Championship,2023-04-05 19:29:08,2023-04-05,iRacing,1,0,1,0,https://i.redd.it/jupdz378p3sa1.png
12cro9u,TREATMENT,Famous structures combined,2023-04-05 19:29:28,2023-04-05,midjourney,1,0,1,0,https://www.reddit.com/gallery/12cro9u
12crnzm,TREATMENT,Trump saying he doesn’t believe in Repenting.,2023-04-05 19:29:09,2023-04-05,HarpazoRapture,1,0,1,0,https://youtu.be/mFruUe4CEQ0
12cro76,TREATMENT,Five deaths confirmed in southeast MO tornado Wednesday morning; search efforts continue,2023-04-05 19:29:23,2023-04-05,missouri,1,0,1,0,https://www.news-leader.com/story/news/local/missouri/2023/04/05/southeast-missouri-bollinger-co-sheriffs-office-confirms-five-dead-in-tornado-wednesday/70085119007/
12cro4f,TREATMENT,Where to buy Rec gas?,2023-04-05 19:29:18,2023-04-05,lexington,1,0,1,0,https://www.reddit.com/r/lexington/comments/12cro4f/where_to_buy_rec_gas/
12cro77,TREATMENT,Stand Alone status Professional Accounting Certificate,2023-04-05 19:29:23,2023-04-05,yorku,1,0,1,0,https://www.reddit.com/r/yorku/comments/12cro77/stand_alone_status_professional_accounting/
12cro7y,TREATMENT,Psychiatrists are mentally retarded chimpanzees who spew forth incoherent screeches :,2023-04-05 19:29:24,2023-04-05,Antipsychiatry,1,0,1,0,https://www.reddit.com/r/Antipsychiatry/comments/12cro7y/psychiatrists_are_mentally_retarded_chimpanzees/
